{
  "kind": "EASI.CodegenRequest",
  "version": "1.0.0",
  "targetLanguage": "javascript",
  "manifest": {
    "ref": "urn:manifest:basic-dicom-read"
  },
  "style": {
    "apiStyle": "fluent-builder",
    "bindingStyle": "late",
    "includeComments": true,
    "includeImports": true,
    "includeResultHandling": true
  },
  "output": {
    "mode": "snippet",
    "functionName": "buildPipeline"
  }
}
